Page1,Statement1,Page2,Statement2
48,"In Babita Lila and Another v. Union of India, (2016)
9 SCC 647, a Division Bench of this Court similarly considered
the jurisdiction of the Deputy Director of Income Tax to make a
complaint under Section 195(1)(b), CrPC in respect of false
statements given on oath during a search operation conducted
under the Income Tax Act, 1961.",48,"The discussion in this case was
primarily concerned with whether the Deputy Director would be
48"
49,"21.2 In Chandrapal Singh and Others v. Maharaj Singh
and Another, (1982)",49,"1 SCC 466, a three­Judge Bench of this
Court was faced with the issue of whether 195(1)(b)(i), CrPC
would bar a complaint under Sections 193, 199 and 201 of the
IPC alleging making of false statements in affidavit before the
Rent Control Officer under the U.P, Urban Buildings (Regulation
of Letting, Rent and Eviction) Act, 1972."
50,"The three­Judge Bench noted that under the 1972 Act, the
Rent Control Officer was authorized to exercise the powers and
functions of the District Magistrate.",50,"Hence, in view of the specific
provision made under Section 34(2) of the 1972 Act, the Rent
Control Officer would also be deemed to be a civil court and the
proceedings before him would be judicial proceedings."
50,"Even otherwise, on the facts of the case, the three­Judge Bench
found that abuse of criminal process had taken place and
observed that “chagrined and frustrated litigants should not be
permitted to give vent to their frustration by cheaply invoking the
jurisdiction of the criminal court” (Chandrapal Singh, (supra),
paragraph 14).",50,"It can be seen from the above discussion that this
Court has, in some instances, opined that where the law deems
proceedings before a certain authority to be “judicial
50"
51,"None of the aforequoted cases were concerned with fabrication of
evidence before an investigating authority under a penal statute.",51,"In the present case, pursuant to recovering the seized
currency from the Appellant’s house on 24.01.2001, the
Respondent initiated investigation under Section 13(2) read with
Section 13(1)(e), PC Act against him."
52,"The Appellants’ intention was not to mislead
the Trial Court, at least not at the first instance.",52,"Rather, their
52"
53,"Hence
it cannot be said that the offence under Sections 120B read with
193, IPC was committed by the Appellants “in relation to” a
proceeding in a court under Section 195(1)(b)(i), CrPC.",53,"22.2 Section 2(i), CrPC defines “judicial proceeding” as
including any proceeding in the course of which evidence is or
may be legally taken by oath."
53,"Thus, it can be concluded that the investigation
conducted by the Respondent under the PC Act cannot be
53",54,"equated with a proceeding in a court of law under Section 195(1)
(b)(i), CrPC, though it is deemed to be a stage of a judicial
proceeding under Section 193, IPC."
54,"However, in the
present case, the investigating agency has been sagacious
enough to detect the commission of offence under Section 193,
IPC at the preliminary stage.",54,"Therefore, as stated by us in
paragraph 17.3 (supra), it would be unjust and impracticable to
insist upon the requirement of an independent inquiry and
written complaint by the Trial Court in such a scenario.
23."
55,"The High Court
has rightly observed that the Appellant/Accused No. 1 had not
raised the defence of holding the money in escrow for Accused
Nos.",55,"2 and 3 at the time of search conducted at his house on
24.01.2001."
55,"2 and 3 at a
highly belated stage on 4.02.2002, almost a year after the
recovery of the seized currency, though the Appellant had
corresponded with Accused No. 2 in May­June, 2001.",55,"It is
improbable in the ordinary course of conduct that a person
would wait so long to claim an amount of approximately Rs. 80
lakhs which was required for completion of sale transaction."
55,"Hence it is apparent that the Appellants/accused
entered into an elaborate conspiracy and attempted to create a
false circumstance of escrow transaction for the purpose of
shielding Appellant/Accused No. 1 from prosecution.",55,"In fact, the
High Court has shown great lenity by reducing the sentences
awarded to the Appellants/accused in view of their advanced age
55"
56,"The questions of law formulated in paragraph 6
(supra) are answered as follows:
Section 195(1)(b)(i), CrPC will not bar
prosecution by the investigating agency for offence
punishable under Section 193, IPC, which is
committed during the stage of investigation.",56,"This is
provided that the investigating agency has lodged
complaint or registered the case under Section 193,
IPC prior to commencement of proceedings and
production of such evidence before the trial court."
56,"In such circumstance, the same would not be
considered an offence committed in, or in relation
to, any proceeding in any Court for the purpose of
Section 195(1)(b)(i), CrPC.",57,"24.1 The appeals are accordingly dismissed both on law and
on merits."
57,"The Appellants are directed to surrender
within two weeks for serving out the rest of their sentence, if they
are not already in custody.",57,"The Registry is further directed to
expeditiously release the amount of fine, if any, deposited before
this Court."
